Topic,Texte,Image,Question 1,,,,Question 2,,,
Protéger la nature,"La pollution lumineuse, également appelée photopollution est la présence de lumière faite par des hommes dans l'environnement de nuit. Elle perturbe les écosystèmes et trouble la faune et la flore. On parle de pollution lumineuse lorsque les éclairages artificiels sont si nombreux qu'ils nuisent à l'obscurité normale et souhaitable de la nuit. Ainsi, à la tombée de la nuit, d'innombrables sources de lumières artificielles (lampes allumées sans cesse dans les rues,...) prennent le relais du soleil dans les centres urbains jusqu'au plus petit village. La pollution lumineuse a des effets sur la santé humaine et aussi un impact sur la faune comme la disparition de certains insectes. ",,Pourquoi,ça masque les étoiles,Cela perturbe la chaine alimentaire,Décélère la croissance des plantes,Quel(s),Désorientation des oiseaux migrateurs,Troubles de sommeil,Les Etats-Unis et la France
Sports ,"Porter de femme - Finlande, c’est une activité physique de course d’obstacles avec le poids de l’amour en plus ! Cette discipline sportive consiste à parcourir une course d’obstacles longue de 250 mètres tout en portant sa compagne. Celle-ci doit peser au minimum 49 kilos ou être lestée en conséquence pour s’ajuster. Pour gagner, l’homme doit porter sa femme sur le dos et terminer un parcours d’obstacles le plus rapidement possible sans laisser tomber sa compagne. C’est une belle allégorie de la vie commune pour certains et sans aucun intérêt pour d’autres. La compétition accueille chaque année quelques milliers de spectateurs.",,Comment,Sur le dos,C'est une piste en sable,Avec un casque,Quel(le),Il y'a un obstacle sec,Le poids de la femme en bières,Il y'a un obstacle d'eau
Sports ,"Chess Boxing - Allemagne Le chess boxing est un mélange de boxe et de jeu d’échecs. C’est un sport qui requiert à la fois de l’intelligence et des muscles. Depuis 1992, ce sport s’est mondialisé et des pays tels que l’Angleterre, l’Allemagne, les Pays-Bas et la France. Les joueurs doivent être compétents à la fois en boxe et aux échecs. L’objectif de la boxe aux échecs est de battre son adversaire en alternant les parties d’échecs et de boxe. Les matchs peuvent être gagnés dans l’une ou l’autre des disciplines, les échecs se terminant par un échec et mat et la boxe par un arrêt ou un match nul.",,Comment,Il est inspiré d'une bande déssinée,Ils mettent un casque anti-bruits,K-O ou échec et mat,Combien,Une minute,11 au maximum,Quatre minutes
Sports ,"Le hockey sous-marin - Canada, est un sport où deux équipes s’affrontent dans l’espoir de pousser une palet de hockey fluorescent dans le but de leur adversaire. Avec le palet au centre de la piscine, une équipe de six joueurs plonge au fond de l’eau en attendant le signal de l’arbitre. Au son du signal, les joueurs sont autorisés à nager dans toutes les directions dans l’aire de jeu afin de déplacer la rondelle dans le but de leur adversaire. Pour jouer au hockey sous-marin, vous devez savoir nager, avoir des bâtons de hockey, faire du plongeon et porter un masque de plongée et un bonnet. Il y'a deux arbitres.",,Pourquoi,Il faut un fond plat,Pour bien le repèrer,Il faut un sous l'eau et un en dehors,Comment,Noirs ou blancs,Caméra aquatique,Par des gestes
Sports ,"Le ninja volleyball - Thailande, c'est un jeu de volley-ball à pied où les joueurs touchent et manipulent le ballon en utilisant uniquement leurs pieds, leurs genoux, leur poitrine et leur tête. Très populaire dans toute l’Asie du Sud-Est, ce jeu se joue avec un ballon en rotin ou synthétique. Comme au volley-ball, ici aussi deux équipes de joueurs essaient de contrôler le ballon et tentent de le faire passer au filet pour le faire passer du côté adverse. Si le ballon ne passe pas le filet, l’équipe adverse marque un point et la première équipe qui marque le maximum de points est déclarée gagnante.",,Comment,Sepak takraw,Un sport national,Une manche est rajoutée,Combien,2 manches,21 points,3 joueurs
Sports ,"Le cheese rolling - Royaume-Uni, Les participants descendent la colline en courant derrière un fromage (le Double Gloucester) ; la première personne à franchir la ligne d'arrivée remporte le fromage. En théorie, le gagnant est censé avoir attrapé le fromage, mais comme celui-ci est lancé avant les concurrents et peut atteindre une très grande vitesse donc voici pourquoi il changèrent un peu les règles du jeu pour remporter le fameux fromage. En 1997 un spectateur fut blessé par le fromage mais cela arrive rarement. Chaque année une compétition est organisée et des ambulances sont prévues en bas de la collines.",,Quel(le),4 kilogrammes,100 mètres,100km/heure,Pourquoi,Les participants tombent dans la colline,L'attraper est presque impossible,Le terrain est en mauvais état
Sports ,"Le repassage extreme, ce sport est totalement énorme. Le concept: prendre une planche à repasser dans le lieu le plus dangereux du monde ou de votre quartier, puis de repasser quelques vêtements.  Le repassage extrême est un sport qui amène le multitâche à un tout autre niveau. Le repassage extrême combine l’acte de repasser et un sport dangereux comme le parachutisme ou la plongée profonde. Il y a eu plusieurs performances de repassage extrêmes dans des endroits incongrus : au sommet d’immenses statues, en canoë, sur de hautes montagnes et même dans les airs avec un parachute. Il y'a meme des compétitions officielles.",,Combien,"Un seul, en Allemagne",10 pays,1005 participants,Qui,Une marque de fers à repasser,Une équipe sud-africaine,Phil Shaw