Topic,Question,Proposition 1,Proposition 2,Proposition 3
Il était une fois les sciences,C'est qui Albert Einstein?,Un médecin trés connu,Un physicien trés connu,Un ingénieur très connu
Robots intelligents,Que contient le programme informatique d'un robot?,Une suite d'instructions données au robot,La mémoire du robot,Les composantes du robot
Le monde des animaux,L'autruche est-elle un oiseau?,Oui,Non,C'est en même temps un oiseau et un mammifère
L'univers,Qu'est ce que la Terre?,Un satellite,Une planète,Une étoile
Protéger la nature,Qu'appelle-t-on recyclage?,Ré-utiliser un produit,Utiliser un produit une seule fois,Ne jamais jeter un produit
Sports,Où sont apparus les jeux olympiques pour la première fois?,Argentine,Chine,Grèce
